18:22	teersi dëkku Sesare, mu dem nuyu mbooloom ñi gëm, ba noppi dem Ancos.
18:23	Bi mu fa desee ay jamono, mu jóge fa, di jaar dëkkoo-dëkk ci diiwaanu Galasi ak Firisi, di dooleel xoli taalibe yépp.
18:24	Amoon na nag Yawut bu tudd Apolos te juddoo Alegsàndiri, mu dikk Efes. Nit ku yeewu la woon te am xam-xam bu yaatu ci Mbind mi.
18:25	Jàngoon na ci yoonu Boroom bi, di ku farlu ci xelam, muy xamle ak a jàngale bu wóor ci mbirum Yeesu, waaye fekk xam-xamam yem ci ni Yaxya daan sóobe ci ndox.
18:26	Noonu mu daldi wax ak fit wu dëgër ca jàngu ba. Bi ko Pirsil ak Akilas déggee nag, ñu woo ko fi ñoom, gën ko leeral yoonu Yàlla.
18:27	Naka mu bëgg a dem Akayi, bokk ya xiir ko ca, ñu bind taalibe ya, ngir ñu teeru ko teeru bu rafet. Noonu mu dikk fa te jariñ lool ñi gëm jaare ko ci yiwu Yàlla.
18:28	Ndaxte mu ngay yey Yawut ya ca kanam ñépp, di firi Mbind yi, ba wone ne Yeesu mooy Almasi bi.
19:1	Ba Apolos nekkee Korent nag, Pool jaar ca teggi ya gën a kawe ca réew ma, door a dikk Efes. Noonu mu gis fa ay taalibe.
19:2	Mu ne leen: «Ndax jot ngeen ci Xel mu Sell mi, bi ngeen gëmee?» Ñu tontu ko: «Déggunu sax ne, Xel mu Sell mi am na.»
19:3	Mu ne leen: «Kon nag, bi ñu leen sóobee ci ndox, lu ciy maana?» Ñu tontu ko: «Xanaa li Yaxya tëral.»
19:4	Pool ne leen: «Yaxya daan na sóob nit ñi ci ndox, ndax bi ñu tuubee seeni bàkkaar; te mu ne bànni Israyil, kiy topp ci moom lañu war a gëm, maanaam Yeesu.»
19:5	Bi ñu déggee loolu nag, sóob nañu leen ci ndox ci turu Yeesu Boroom bi.
19:6	Te bi leen Pool tegee loxo, Xel mu Sell mi ñëw ci ñoom, ñuy wax yeneeni làkk, di wax ci kàddug Yàlla.
19:7	Limub nit ñooñu nekk na lu mat fukk ak ñaar.
19:8	Noonu Pool dugg ca jàngu ba, di wax ak fit wu dëgër diirub ñetti weer, di diisoo ak ñoom ci mbirum nguurug Yàlla, di leen jéem a gëmloo.
19:9	Waaye bi xolu ñenn ci ñoom fattee, ñu gëmadi, bay suufeel yoon wi ci kanam mbooloo ma, mu jóge ci ñoom, xàjjale taalibe yi ak ñoom, di diisoo bés bu nekk ca jàngukaayu ku ñuy wax Tiranus.
19:10	Mu wéy ci noonu diirub ñaari at, ba ñi dëkk diiwaanu Asi ñépp dégg kàddug Boroom bi, muy Yawut muy Gereg.
19:11	Booba Yàllay def ay kéemaan yu ràññiku yuy jaar ci loxoy Pool.
19:12	Ñu yóbbul sax ñi wopp ay kaala ak ay taraxlaay yu laaloon yaramam, ba jàngoro yi di leen bàyyi, rab yay génn ci ñoom.
19:13	Noonu ay Yawut yuy wëndéelu, di faj ñi rab jàpp, ñu di leen jéem a ñaanal ci turu Yeesu Boroom bi naan: «Ci turu Yeesu, mi Pool di yégle, génnleen.»
19:14	Ñi doon def loolu, juróom-ñaari doom lañu woon ci Sewa, mi doon taafantaloo saraxalekat bu mag ba ci Yawut yi.
19:15	Waaye bi ñu ko defee rab wa tontu leen ne: «Xam naa Yeesu, xam naa it kuy Pool, waaye yéenay ñan?»
19:16	Ci kaw loolu nit ka rab jàpp song leen, noot leen ñoom ñépp; mu soxore leen lool, ba ñu daw kër ga, def yaramu neen te gaañu bu metti.
19:17	Loolu siiw na ci ñépp, ñi dëkk Efes, di Yawut ak Gereg; tiitaange jàpp leen ñoom ñépp, ba ñu màggal turu Yeesu Boroom bi.
19:18	Bi loolu amee ñu bare ci ñi gëm ñëw, di wesar ci kanam ñépp seeni jati luxus.
19:19	Te ñu bare ci ñi daan luxus, indi seeni téere, lakk leen ci kanam ñépp. Te bi ñu xaymaa njëg ga, mu tollook juróom-fukki junniy poseti daraxma.
19:20	Noonu la kàddu Boroom bi lawe, te noot lépp.
19:21	Bi loolu wéyee Pool nas xel jëm Yerusalem, jaar ci diiwaani Maseduwan ak Akayi. Mu ne: «Gannaaw bu ma fa demee, fàww ma seeti Room it.»
19:22	Mu yebal nag ci Maseduwan ñaari jaraafam, di Timote ak Erast, waaye moom mu des ab diir ci Asi.
19:23	Fekk booba amoon na yengu-yengu bu réy ci lu aju ci Yoon wi.
19:24	Ndaxte nit ku tudd Demetirus, di tëggu xaalis buy defar nataali xaalis ngir màggal Artemis, daan na ci jariñu lu bare, moom ak ay nawleem.
19:25	Noonu mu dajale leen ak seeni liggéeykat ne leen: «Gaa ñi, xam ngeen ne, sunu njariñ mu ngi aju ci liggéey bii.
19:26	Gis ngeen nag te dégg ne, Pool male gëmloo na bay fàbbi mbooloo mu bare, waxuma ci Efes rekk, waaye ci biir Asi gépp naan: “Yàlla yu ay loxo defar duñu ay yàlla.”
19:27	Léegi kat loraangee ngi nuy yoot, te du yem ci xañ nu sunu liggéey rekk, waaye it dina daaneel màggalukaayu Artemis sunu yàlla ju mag ji, tey neenal ndamam, moom mi Asi gépp te àddina sépp di màggal.»
19:28	Bi ñu déggee loolu, mer mu réy tàbbi ci ñoom, ñuy yuuxu ne: «Artemis mu Efes màgg na!»
19:29	Noonu dëkk bépp jaxasoo. Ñu bokk benn xalaat, daldi ne milib ca powukaay ba, diri Gayus ak Aristàrk, waa Maseduwan, ñi ànd ak Pool.
19:30	Pool nag bëgg a dugg ca mbooloo ma, waaye taalibe ya nanguwuñu ko.
19:31	Ñenn ca jawriñi nguur gi it, ñuy ay xaritam, yónnee ci moom, di ko dénk, mu bañ a jaay bakkanam ci dugg ca powukaay ba.
19:32	Noonu ndaje ma rëb, ba ñii di yuuxu lii, ñale di yuuxu laa, te ña ca gën a bare xamuñu lu waral ndaje ma.
19:33	Ci kaw loolu Yawut ya jéñ Alegsàndar ci kanam, te mbooloo ma di ko xaacu ay ndigal, mu daldi tàllal loxoom, ngir làyyi ca mbooloo ma.
19:34	Waaye bi ñu xamee ne Yawut la, ñépp a bokk benn baat, yuuxu diirub lu mat ñaari waxtu naan: «Artemis mu Efes màgg na!»
19:35	Gannaaw loolu boroom dëkk ba dalal mbooloo ma ne leen: «Yéen waa Efes, ana ku xamul ne, dëkku Efes moo di wottukaayu màggalukaayu Artemis ak nataalam, bi wàcce asamaan?
19:36	Gannaaw nag kenn mënta weddi loolu, war ngeen a dalal seen xel te bañ a sañaxu ci dara.
19:37	Ndaxte nit ñii ngeen fi indi sàccuñu ca màggalukaay ya te sosaluñu sunu yàlla.
19:38	Su fekkee ne Demetirus ak ay nawleem jànkoonte nañu ak kenn, am na ay bési layoo ak ñu yilif réew mi; nañu fa woo ku ñu amleenteel.
19:39	Waaye su ngeen di laaj leneen, mbooloom dëgg dina ko àtte.
19:40	Ndaxte fi mu ne man nañu noo jiiñ jógug mbooloo mi ndax li fi xew tey. Te bu loolu amee dunu am aw lay ci mbirum mbooloo mu rëb mii, ndaxte amul dara lu ko waral.»
19:41	Bi mu waxee loolu nag, mu tas mbooloo ma.
20:1	Bi yengu-yengu ba dalee, Pool woo taalibe ya fa moom, dooleel leen. Bi mu ko defee mu tàggoo ak ñoom, jóge fa, dellu diiwaanu Maseduwan.
20:2	Noonu mu jaar ca bérab yooyu, di dooleel nit ñi ak wax yu bare; ba noppi mu dem réewu Geres,
20:3	toog fa ñetti weer. Waaye bi mu nekkee ci kaw tànki dugg gaal jëm diiwaanu Siri, te Yawut yi lalal ko pexe, mu fas yéenee dellu, jaare Maseduwan.
20:4	Booba nag ñii ñoo ànd ak moom: Sopater, doomu Pirus mi dëkk Bere; Aristàrk ak Segond, ñi dëkk Tesalonig; Gayus, mi dëkk Derbë, ak Timote; te it Tisig ak Torofim ñi dëkk Asi.
20:5	Ñooñu nag jiitu, di nu nég dëkku Torowas.
20:6	Waaye naka nun, gannaaw màggalu Yawut, ga ñuy wax Mburu ya amul lawiir, nu dugg gaal ci Filib, def ci juróomi fan, fekksi leen Torowas, nu am fa juróom-ñaari fan.
20:7	Ca bés bu jëkk ca ayu-bés ga, booloo nanu ngir damm mburu ma. Te Pool, mi bëggoon a dem ca ëllëg sa, di diisoo ak ñoom te waxtaanam law ba ci xaaju guddi.
20:8	Ca néeg bu kawe, ba nu booloo nag, amoon na fa làmp yu bare.
20:9	Noonu waxambaane wu tudd Ëtikus te toog ca palenteer ba, gëmmeentu bay jeyaxu. Bi Pool di gën a yaatal waxtaanam nag, nelaw daldi ko jàpp, mu xàwweekoo ca ñetteelu taax ma, daanu, ñu yékkati ko, fekk mu dee.
20:10	Waaye Pool wàcc, daldi sëgg ci kawam, roof ko loxoom ne leen: «Bàyyileen jooy yi, mu ngi dund.»
20:11	Noonu mu yéegaat, damm mburu ma, lekk; ba noppi delluwaat ci waxtaanam, di ko yaatal ba ca njël, door a tàggoo.
20:12	Naka waxambaane wa, ñu indi ko muy dund, ba seen xol sedd guyy.
20:13	Nun nag nu jiitu, dugg gaal jëm Asos, fa nu Pool santoon, nu jële ko fa; fekk moom fas na yéeney dox, ba agsi fa.
20:14	Noonu mu fekksi nu ci Asos, nu jël ko ca gaal ga, dem Mitilen.
20:15	Gannaaw loolu gaal ga jóge fa, nu agsi ca ëllëg sa janook dunu Kiyos. Bés ba ca tegu nag nu jàll ba Samos, te ñetteelu fan ba nu àgg Mile.
20:16	Ndaxte Pool fasoon na yéenee teggi Efes, ngir bañ a yàgg ci diiwaanu Asi; mu ngi doon gaawantu, ngir màggal, gi ñuy wax Pàntakot fekk ko Yerusalem.
20:17	Bi Pool eggee Mile nag, mu yónnee ca Efes, ngir woo njiiti mbooloom ñi gëm.
20:18	Bi ñu ñëwee, mu ne leen: «Yéen xam ngeen bu baax, ni ma doon doxale diirub sama ngan gépp ci seen biir, li dale ci bés bi ma jëkkee teg tànk ci Asi ba tey.
20:19	Jaamu naa Boroom bi ci woyof gu mat ak ay rangooñ, dékku ay nattu yu ma pexey Yawut yi indil.
20:20	Xam ngeen ne, musuma leen a nëbb dara lu leen di jariñ, di leen jàngal ci kanamu ñépp ak ca kër ya.
20:21	Dénk naa Yawut yi ak Gereg yi ne leen, ñu tuub seeni bàkkaar, ba woññiku ci Yàlla te gëm sunu Boroom Yeesu.
20:22	«Léegi maa ngi nii di dem Yerusalem, ci li ma Xelu Yàlla mi xiirtal, te xawma lu ma fay dal.
20:23	Xam naa rekk ne, ci dëkkoo-dëkk Xel mu Sell mi xamal na ma ne, ay buum ak ay metit ñu ngi may nég.
20:24	Waaye sama bakkan soxalu ma, su fekkee bey naa sama sas, ba matal liggéey, bi ma Boroom bi dénk, maanaam ma seedeel ci ñépp xebaar bu baax, bi ëmb yiwu Yàlla.
20:25	«Fi mu ne nag xam naa ne, dootuleen gis sama kanam, yéen ñépp ñi ma jaaroon ci seen biir, di yégle nguuru Yàlla.
20:26	Moo tax may dëggal tey jii ne, wàccoo naa ak yéen ñépp bés pénc.
20:27	Ndaxte ñeebluwuma leen, ci di leen xamal lépp li Yàlla digle.
20:28	Wottuleen nag seen bopp te wottu coggal jépp, ji leen Xel mu Sell mi def sàmm, ngeen sàmm mbooloo, mi Yàlla jotal boppam ak deretu Doomam.
20:29	Xam naa ne, bu ma leen wonee gannaaw, bukki yu soxor dinañu tàbbi ci coggal ji te duñu ci ñeeblu kenn.
20:30	Ay nit dinañu jóg ci seen biir sax, di wax luy sànke, ngir sàkku ay taalibe.
20:31	Foogleen nag, di fàttaliku ne diirub ñetti at, guddi ak bëccëg, musumaa noppi di leen artu kenn ku nekk ci yéen ak ay rangooñ.
20:32	«Léegi nag maa ngi leen di dénk Boroom bi, moom ak kàddug yiwam, gi leen man a dëgëral te may leen cér ci biir gaayi Yàlla yu sell yépp.
20:33	Nammuma xaalisu kenn mbaa wurusam mbaa koddaayam.
20:34	Xam ngeen ne, faj naa samay soxla ak soxlay ñi ànd ak man ci sama loxo yii.
20:35	Ci lépp won naa leen royukaay, ci li nu war a dimbali ñi néew doole te fàttaliku li Yeesu Boroom bi wax moom ci boppam ne: “Joxe moo gën a barkeel nangu.”»
20:36	Bi mu waxee loolu, mu sukk ak ñoom ñépp, ñaan ci Yàlla.
20:37	Te ñépp jooy bu metti, di laxasu ci baatu Pool, fóon ko bu baax.
20:38	Li leen gën a teg aw tiis mooy li mu leen wax: «Dootuleen gis sama kanam.» Noonu ñu gunge ko ba ca gaal ga.
21:1	Bi nga xamee ne tàggoo nanu ak ñoom ci naqar, nu dugg gaal, jubal dunu Kos. Te ca ëllëg sa nu dem ba teer ca Rodd, ba noppi jóge fa, jàll ba Patara.
21:2	Foofa nag nu gis gaal guy jàll ba Fenisi, nu dugg ca, mu daldi teddi.
21:3	Noonu nu séen dunu Sipar, bàyyi ko ci sunu càmmooñ, jublu diiwaanu Siri, nu teersi Tir. Ndaxte foofa la gaal gi war a yebbee la mu yeboon.
21:4	Nu wut taalibe ya, ba gis leen, toog ak ñoom juróom-ñaari fan. Ñoom nag ñu ne Pool ci li leen Xelu Yàlla mi may, mu bañ a dem Yerusalem.
21:5	Moona bi jataayu gaal ga matee, nu awaat ci yoon wi. Te ñépp gunge nu, ñoom ak seeni jabar ak seeni doom; nu génn dëkk ba, sukk ca tefes ga, ñaan ci Yàlla.
21:6	Noonu nu tàggoo ak ñoom, dugg ca gaal ga, ñu dellu seen kër.
21:7	Bi nu jógee Tir nag, nu demaat ci géej, ba teer Patolemayis. Foofa nu nuyu bokk ya, yendu, fanaan.
21:8	Nu jóge fa ca ëllëg sa, ñëw ba ca dëkku Sesare. Nu dugg ca kër Filib, taskatu xebaar bu baax bi, mi bokk ci Juróom-ñaar ña, nu dal fa moom.
21:9	Amoon na ñeenti doom yuy janq, ñuy wax ci kàddug Yàlla.
21:10	Bi nu fa nekkee ay fan nag, yonent bu tudd Agabus jóge Yude, agsi.
21:11	Mu ñëw ci nun, daldi yeew ay loxoom ak i tànkam ak laxasaayu Pool naan: «Nii la Xel mu Sell mi waxe: “Ki moom laxasaay gii, Yawut yi dinañu ko yeewe nii ca Yerusalem, jébbal ko ñi dul Yawut.”»
21:12	Bi nu déggee loolu, nun ak ña fa nekk nu ñaan Pool, mu bañ a dem Yerusalem.
21:13	Ci kaw loolu Pool tontu ne: «Lu ngeen di jooy, di yàq sama xol? Bañuma ñu yeew ma rekk, waaye nangu naa sax, ñu rey ma ci Yerusalem ngir turu Yeesu Boroom bi.»
21:14	Bi nu ko mënul a dëpp, nu noppi ne: «Kon na coobareg Boroom bi am!»
21:15	Gannaaw fan yooyu nu defaru, ngir dem Yerusalem.
21:16	Noonu ay taalibe yu dëkk Sesare ànd ak nun, yóbbu nu ca nit ku tudd Manason, fu nu war a dal; moom nag nitu Sipar la woon, di taalibe bu yàgg.
21:17	Bi nu agsee Yerusalem nag, taalibe ya teeru nu ak mbég.
21:18	Ca ëllëg sa Pool ànd ak nun, seeti Saag, fekk njiit yépp teew fa.
21:19	Noonu Pool nuyu leen, nettali leen benn-benn li Yàlla def ci biir ñi dul Yawut, jaarale ko ci liggéeyam.
21:20	Bi ko njiit ya déggee, ñu màggal Yàlla ne ko: «Mbokk mi, gis nga ne, am na ay junniy Yawut ñu gëm, te ñépp a sawar ci yoonu Musaa.
21:21	Dégg nañu ci sa mbir nag ne, yaa ngi jàngal Yawut yépp, yi dëkk ci biir ñi dul Yawut, ñu bàyyi yoonu Musaa te bañ a xarafal seeni doom mbaa topp sunuy aada.
21:22	Lu nu ci war a def nag? Ndaxte ci lu wér dinañu xam ne, ñëw nga.
21:23	Nu ngi lay digal nag, nga def nii: am na ci nun ñeenti góor yu dige ak Yàlla.
21:24	Jël leen, bokk ak ñoom setlu, te nga gàddu seen peyu wateef. Noonu ñépp dinañu xam ne, li ñu déggoon ci sa mbir du dëgg, waaye yaa ngi jëf tey sàmm yoonu Musaa.
21:25	Naka ñi dul Yawut ñi gëm, bind nanu leen li nu àtte ne, ñu moytu ñam wu ñu tuuroo xërëm te moytu deretu médd ak njaaloo.»
21:26	Bi ñu ko waxee, Pool jël nit ña te ca ëllëg sa mu bokk setlu ak ñoom, ñu dugg ca kër Yàlla ga. Ñu xamle ban bés la seen setlu di àgg, di bés bu ñuy jébbale sarax ngir kenn ku nekk ci ñoom.
21:27	Bi àppu juróom-ñaari fan ya di bëgg a jeex, Yawut yi jóge diiwaanu Asi gis Pool ca kër Yàlla ga. Ñu daldi jógloo mbooloo mépp, jàpp ko,
21:28	di xaacu ne: «Wallee, wallee, yéen bokki Israyil; waa jaa ngi nii, moom miy waare fépp ak ci ñépp, bay suufeel sunu xeet ak yoonu Musaa ak bérab bii; dugal na sax ay Gereg fii ci kër Yàlla gi, ba indi sobe ci bérab bu sell bii.»
21:29	Li tax ñu wax loolu, mooy gisoon nañu Torofim mu Efes, ànd ak moom ca dëkk ba, te ñu yaakaar ne, Pool dugal na ko ca kër Yàlla ga.
21:30	Noonu dëkk ba bépp màbb, mbooloo ma ne këpp, ñu jàpp Pool, génne ko ca kër Yàlla ga. Ca saa sa ñu tëj bunt ya.
21:31	Bi ñu koy wut a rey, xebaar ba agsi ba ca kilifag mbooloom xarekat ba, naan Yerusalem gépp jaxasoo na.
21:32	Ca saa sa mu ànd ak ay xarekat ak ay njiiti xare, ne jaas wàcc ci ñoom. Bi Yawut ya gisee kilifa ga ak xarekat ya nag, ñu daldi bàyyi dóor, ya ñu doon dóor Pool.
21:33	Noonu kilifa ga jegesi jàpp ko, santaane ñu jéng ko ak ñaari càllala. Bi ñu ko defee mu laaj ku mu doon ak lu mu def.
21:34	Waaye ci biir mbooloo ma, bu ñii nee lii, ña ca des ne laa. Kon nag gannaaw mënu caa xam dara lu wóor ndax coow li, mu santaane, ñu yóbbu ko ci biir tata ja.
21:35	Bi Pool eggee ca yéegukaayu tata ja, aaytalu mbooloo ma réy, ba ay xarekat fab ko.
21:36	Ndaxte mbooloo maa nga ko topp, di xaacu ne: «Reyleen ko!»
21:37	Bi ñu koy bëgg a dugal ca tata ja, Pool ne kilifa ga: «Ndax man naa laa wax dara?» Mu tontu ko: «Yaw dégg nga gereg?
21:38	Kon nekkuloo waayi Misra, jooju jógloo woon nit ñi keroog te yóbbu woon ñeenti junniy bóomkat ca màndiŋ ma?»
21:39	Pool ne ko: «Man Yawut laa, di jaambur ci Tars, dëkk bu am tur ci diiwaanu Silisi. Maa ngi lay ñaan, ma wax ak mbooloo mi.»
21:40	Te kilifa ga may ko ko. Noonu Pool taxaw ca yéegukaay ba, tàllal loxoom mbooloo ma, ñu daldi ne tekk. Mu wax ak ñoom ci làkku yawut ne:
22:1	«Yéen bokk yi ak baay yi, dégluleen samaw lay.»
22:2	Bi ñu déggee, mu di leen wax ci làkku yawut, ñu gën ne xeram. Noonu Pool ne leen:
22:3	«Man Yawut laa, juddoo Tars ci diiwaanu Silisi, yaroo ci dëkk bii. Taalibe laa woon ci Gamaleel, mu jàngal ma bu wér yoonu sunuy maam, ba ma sawar ci Yàlla, mel ni yéen ñépp tey.
22:4	Daan naa fitnaal ña bokkoon ci yoon wii, ba di ci rey sax; yeew naa góor ak jigéen, tëj leen;
22:5	saraxalekat bu mag ba ak mbooloom njiit yi yépp man nañu ma cee seede. Am bés ñu bindal ma ay bataaxal ngir bokki Damas. Ma doon fa dem, ngir yeew ña fa nekkoon, indi leen Yerusalem, ngir ñu yar leen.
22:6	«Waaye ci digg-bëccëg, bi ma jaaree ca yoon wa, ba jegesi Damas, ca saa sa leer gu mag jóge asamaan, melax ba ëmb ma.
22:7	Ma daldi ne nërëm ci suuf, dégg baat bu ma ne: “Sool, Sool, lu tax nga di ma fitnaal?”
22:8	Ma tontu ko: “Yaa di kan, Boroom bi?” Mu ne ma: “Maa di Yeesum Nasaret, mi ngay fitnaal.”
22:9	Ñi ma àndaloon gis nañu leer ga, waaye dégguñu baatu ka doon wax ak man.
22:10	Noonu ma laaj ko: “Lu ma war a def, Boroom bi?” Boroom bi ne ma: “Jógal dem Damas, foofa dees na la biral lépp, li ma la yen.”
22:11	Gannaaw gisuma woon dara ndax leeraayu melxat ga, ña ma àndal wommat ma, ma ñëw Damas.
22:12	«Bi ma ko defee ku tudd Anañas ñëw ci man. Nit ku ragal Yàlla la woon ci sàmm yoonu Musaa, te Yawuti Damas yépp seedeel ko lu baax.
22:13	Mu taxaw ci sama wet ne ma: “Sool sama mbokk, delluwaatal di gis.” Noonu ma daldi gisaat ca saa sa, xool ko.
22:14	Mu ne ma: “Sunu Yàllay maam tànn na la, ba may la, nga xam coobareem te gis Aji Jub ji te nga dégg ay waxam.
22:15	Ndaxte li nga gis te dégg ko, dinga ko seede ci ñépp.
22:16	Léegi nag, looy nég? Jógal, ñu sóob la ci ndox, nga set ci say bàkkaar ci tudd turu Yeesu.”
22:17	«Bi ma dellusee Yerusalem nag, di ñaan ca kër Yàlla ga, leer tàbbi ci man.
22:18	Ma daldi gis Boroom bi, mu ne ma: “Génnal Yerusalem ci ni mu gën a gaawe, ndaxte duñu nangu li ngay seede ci man.”
22:19	Waaye ma tontu ne: “Boroom bi, xam nañu ne, dama daan wër jàngoo-jàngu, di tëj kaso ak di dóor ay yar ñi la gëm.
22:20	Rax-ca-dolli bi ñu tuuree deretu Ecen, mi la doon seedeel, teewe naa ko, ànd ca, bay wottu sax yérey ñi ko doon rey.”
22:21	Waaye Boroom bi ne ma: “Demal, dinaa la yebal fu sore, nga jëm ci xeeti ñi dul Yawut.”»
22:22	Mbooloo ma déglu ko nag ba ca wax jooju, waaye bi ñu déggee loolu, ñu daldi yuuxu naan: «Farleen ko ci àddina! Yembar mu mel ni moom yeyoowul a dund!»
22:23	Ñu daldi yuuxu ak di sànni seeni yére, tey callameeru suuf.
22:24	Noonu kilifa ga santaane, ñu dugal Pool ca tata ja te caw ko ay yar yu metti, laaj ko ba xam lu tax ñu di ko yuuxoo nii.
22:25	Waaye bi ñu koy joñ ak ay der, Pool ne njiitu xare ba fa taxaw: «Ndax am nga sañ-sañu dóor ay yar jaamburu Room, te fekk yoon dabu ko sax?»
22:26	Bi ko njiit la déggee, mu fekki kilifaam, yégal ko ko; mu ne ko: «Ndax xam nga li ngay def? Nit kale jaambur la ci Room.»
22:27	Noonu kilifa ga ñëw laaj Pool: «Wax ma, ndax jaambur nga ci Room?» Mu tontu ko: «Waaw, moom laa.»
22:28	Kilifa ga ne ko: «Man fey naa xaalis bu bare, ngir nekk jaambur ci Room.» Waaye Pool tontu ko: «Man de dama koo judduwaale.»
22:29	Ñi ko bëggoon a dóor ay yar nag randu ko ca saa sa. Te kilifa ga sax tiit ci xam ne Pool jaamburu Room la, te yeewlu na ko.
22:30	Ca ëllëg sa mu bàyyi ko, ndaxte bëggoon na xam bu wóor lu ko Yawut ya jiiñ. Mu santaane ne, saraxalekat yu mag ya dajaloo, ñoom ak kureelu àttekat ya. Gannaaw loolu mu indilu Pool, dëj ko ci seen kanam.
23:1	Noonu Pool xool jàkk géew ba ne leen: «Bokk yi, ci xel mu dal laa doxale ci kanam Yàlla ba ci bésu tey bi.»
23:2	Ci kaw loolu saraxalekat bu mag ba, di ku ñuy wax Anañas, sant ña taxaw ca wetam, ñu fél gémmiñam.
23:3	Pool ne ko: «Yàlla dina la dóor, yaw mi naaféq, bay samandaay miir bu joy bu ñu weexal. Yaa ngi toog di ma àtte, ci li yoon wi digle, ba noppi santaane ñu dóor ma, ci li yoon wi tere!»
23:4	Waaye ña taxaw ca wetam ne ko: «Ndax dangay xas saraxalekat bu mag, bi Yàlla fal?»
23:5	Pool tontu leen: «Bokk yi, xawma woon ne saraxalekat bu mag bi la, ndaxte tëral nañu ci Mbind mi ne: “Bul wax lu bon sa kilifag xeet.”»
23:6	Naka noona Pool, mi xam ne, genn-wàllu kureel ga bokk nañu ci tariixab Sadusen ya, te ña ca des bokk ci tariixab Farisen ya, mu wax ci kaw ci biir géew ba ne: «Bokk yi, man Farisen laa, te Farisen moo ma jur; li tax ñu may àtte tey mooy sama yaakaar ci ne, ñi dee dinañu dekki.»
23:7	Bi mu waxee loolu nag, werante wu metti daldi xew diggante Farisen ya ak Sadusen ya, ba mbooloo ma xaajalikoo.
23:8	Ndaxte Sadusen yi nanguwuñu ne, ndekkite mbaa malaaka mbaa rab, dara am na ci, waaye Farisen nangu nañu yooyu yépp.
23:9	Ci kaw loolu nag coow lu bare daldi jib. Ñenn ca xutbakat, ya bokk ca Farisen ya, ne bërét, daldi xuloo bu metti ne: «Gisunu dara lu bon ci nit kii. Su fekkeente ne, rab a ko wax mbaa malaaka...?»
23:10	Noonu xuloo ba daldi gën a tàng, ba kilifa ga ragal ne, nit ñi dinañu daggaate Pool. Kon mu sant xarekat ya, ñu wàcc, nangu Pool ci ñoom, yóbbu ko ca tata ja.
23:11	Ca guddi ga nag Boroom bi taxaw ci wetu Pool ne ko: «Takkal sa fit; ni nga ma seedee ci Yerusalem, noonu nga may seedee ca Room.»
23:12	Bi bët setee Yawut ya daldi lal pexe; ñu dige ci ngiñ ne, duñu lekkati, duñu naanati, ba kera ñuy rey Pool.
23:13	Ña lal pexe ma, seen lim ëpp na ñeent-fukk.
23:14	Noonu ñu dem ca saraxalekat yu mag ya ak njiit ya ne leen: «Giñ nanu ne, dunu mos dara, ba kera nuy rey Pool.
23:15	Léegi nag yéen ak kureelu àttekat ya, laajleen kilifa ga, mu indi ko ci seen kanam, mel ni dangeen a bëgg a seet mbiram bu gën a wóor. Bu ko defee nun dinanu fagaru, ngir rey ko, bala moo agsi.»
23:16	Waaye jarbaatu Pool yég fiir ga, mu dem, dugg ca tata ja, yégal ko Pool.
23:17	Bi ko Pool déggee, mu woo kenn ca njiiti xare ba ne ko: «Yóbbul waxambaane wii ca kilifa ga, ndax am na lu mu ko war a yégal.»
23:18	Njiit la jël ko, yóbbu ko ca kilifa ga ne ko: «Pool, mi ñu jàpp, moo ma woo, ñaan ma, ma indil la waxambaane wii, ndaxte am na lu mu lay wax.»
23:19	Noonu kilifa ga jàpp ci loxob waxambaane wa, wéetoo ak moom, laaj ko: «Loo ma bëgg a yégal?»
23:20	Mu tontu ne: «Yawut yi dañoo dige, ngir ñaan la, nga indi Pool ëllëg ca kanamu kureelu àttekat ya, mel ni dañoo bëgg a seet mbiram bu gën a wóor.
23:21	Bu leen ko may, ndaxte lu ëpp ñeent-fukk ci ñoom ñu ngi koy lalal fiir. Dige nañu ak ngiñ ne, dootuñu lekk, dootuñu naan, li feek reyuñu ko; fi mu ne sax fagaru nañu, di xaar, nga nangu.»
23:22	Kilifa ga nag sant waxambaane wa, mu bañ koo àgge kenn, ba noppi mu yiwi ko, mu dem.
23:23	Bi mu ko defee mu woo ñaar ci njiiti xare ba ne leen: «Waajal-leen ñaari téeméeri xarekat ak juróom-ñaar-fukki gawar ak ñaari téeméer ñu gànnaayoo xeej, ngeen dem Sesare ci juróom-ñeenti waxtu ci guddi.
23:24	Wutal-leen it Pool lu mu war, ngeen yóbbu ko ci jàmm ak salaam ba ca Feligsë, boroom réew mi.»
23:25	Noonu mu bind bataaxal bii:
23:26	Yaw Feligsë mu tedd mi, di boroom réew mi; man Këlódd Lisiyas maa ngi lay nuyu.
23:27	Yawut yi jàpp nañu nit kii, bëgg koo rey, waaye bi ma yégee ne, jaambur la ci Room, wallu naa ko ak ay xarekat, ba musal ko.
23:28	Bëggoon naa xam lu tax ñu kalaame ko. Moo tax ma yóbbu ko ca kanamu seen kureelu àttekat ya.
23:29	Gis naa ne li ñu ko jiiñ mu ngi aju ci ay werantey seen yoon, waaye jiiñuñu ko dara lu jar dee mbaa jéng.
23:30	Te bi ma déggee ne, ñu ngi koy fexeel, yebal naa ko ci yaw ci saa si. Sant naa nag ñi ko kalaame, ñu xamal la seen lay.
23:31	Noonu xarekat ya jël Pool ci guddi, indi ko ba ca dëkku Antipataris, ni ñu leen ko sante.
23:32	Ca ëllëg sa ñu woññiku, dellusi ca tata ja, bàyyi gawar ga, ñu gunge ko.
23:33	Bi gawar ga àggee Sesare, ñu jox boroom réew ma bataaxal ba, jébbal ko Pool.
23:34	Bi loolu amee boroom réew ma jàng bataaxal ba, laaj ci ban diiwaan la Pool dëkk. Bi mu yégee ne, mu ngi dëkk Silisi,
23:35	mu ne ko: «Kon bu ñi la kalaame ñëwee, dinga layoo.» Mu santaane nag, ñu denc ko ca kër buur ba Erodd.
24:1	Bi juróomi fan wéyee, Anañas saraxalekat bu mag ba dikk, ànd ak ay njiit ak layookat bu tudd Tertul, ñu woo Pool ci yoon fa kanam boroom réew ma.
24:2	Noonu ñu woo Pool, te Tertul daldi ko jiiñ naan: «Yaw Feligsë mu tedd mi, sa nguur jural na nu jàmm ju neex, te sa jàppandil soppi na lu bare ci sunu xeet.
24:3	Gis nanu ko fépp ak ci lépp, di la gërëm ak sunu xol bépp.
24:4	Waaye ngir bañ a yàggal jataay bi, maa ngi lay ñaan ci sa lewetaay, nga déglu nu ci lu gàtt.
24:5	Ndaxte ci mbirum nit kii teew, gis nanu ne rambaaj la, buy indi xëccoo ci Yawut yi ci àddina sépp, di njiitu mbooloo mu ñuy wax Nasaréen.
24:6	Dem na ba jéem a teddadil sax kër Yàlla ga, waaye jàpp nanu ko.
24:8	Soo ko laajee, yaw ci sa bopp, dinga gis ne, li nu koy jiiñ dëgg la.»
24:9	Ci kaw loolu Yawut ya ànd ca, di dëggal ne loolu wóor na.
24:10	Bi loolu amee boroom réew ma jox Pool kàddu gi. Noonu mu làyyi ne: «Xam naa ne, yaa ngi àtte xeet wi diirub at yu bare, moo tax maa ngi làyyi ak kóolute.
24:11	Man ngaa wóorliku ne, ëppagul fukki fan ak ñaar demoon naa Yerusalem ngir màggali.
24:12	Te kenn gisu ma, maay werante mbaa di jógloo mbooloo, muy ca kër Yàlla ga mbaa ca jàngu ya mbaa ci biir dëkk ba.
24:13	Te mënuñoo firndeel dara ci li ñu may jiiñ léegi.
24:14	Waaye nangu naa ci sa kanam ne, maa ngi jaamu Yàllay sunuy maam, ci topp yoon wi ñu ne, mooy tariixa; terewul ne, lépp li ñu tëral ci yoonu Musaa ak li yonent yi bind, gëm naa ko.
24:15	Te bokk naa ak ñoom yaakaar ci Yàlla, ne ñi jub ak ñi jubadi dinañu dekki keroog yawmelxayaam.
24:16	Moo tax fu ma tollu, maa ngi góor-góorlu, ngir am xel mu dal fa kanam Yàlla ak fa kanam nit ñi.
24:17	«Noonu gannaaw gëjeb at yu bare ñëw naa, ngir indil sama xeet ndimbal te jébbal Yàlla ay sarax.
24:18	Bi ma koy def nag, gis nañu ma ca kër Yàlla ga, ma setlu ba noppi, fekk ànduma ak mbooloo te indiwuma benn coow.
